<?xml version="1.0" encoding="UTF-8"?>
<commandSetRoot type="template" xmlns:xsi="http://www.w3.org/2001/XMLSchema-instance"
				xsi:schemaLocation='commandSet.xsd'>
    <commandSet type="serial">
        <name>all_vs_all</name>
        <configMapId>1</configMapId>
        <commandSet type ="parallel">
            <name>get_sequence</name>
            <configMapId>2</configMapId>
            <command>
                <name>RunUnixCommand</name>
                <configMapId>2.1</configMapId>
            </command>
            <command>
                <name>RunUnixCommand</name>
                <configMapId>2.2</configMapId>
            </command>
            <command>
                <name>RunUnixCommand</name>
                <configMapId>2.3</configMapId>
            </command>
            <command>
                <name>RunUnixCommand</name>
                <configMapId>2.4</configMapId>
            </command>
          <restarted>false</restarted>
        </commandSet>
        <command>    
            <name>RunUnixCommand</name>
            <configMapId>1.1</configMapId>
        </command>
        <command>    
            <name>RunUnixCommand</name>
            <configMapId>1.2</configMapId>
        </command>
      <restarted>false</restarted>
    </commandSet>
    <host>aegan-lx</host>
<port>-1</port>
</commandSetRoot>
