<?xml version="1.0" encoding="UTF-8"?>
    
<commandSetRoot type="template" xmlns:xsi="http://www.w3.org/2001/XMLSchema-instance"
				xsi:schemaLocation='commandSet.xsd'>
  <commandSet type="serial" version="3.1.1">
    <name>IDEA-gene</name>
    <configMapId>1</configMapId>
    <command>
      <name>run-paml</name>
      <configMapId>1.2</configMapId>
      <type>RunUnixCommand</type>
      <param>
	<key>command</key>
	<value><IDEA_BASE_DIR>/idea-B-run-paml.pl</value>
      </param>
    </command>
    <command>
      <name>merge-runs</name>
      <configMapId>1.3</configMapId>
      <type>RunUnixCommand</type>
      <param>
	<key>command</key>
	<value><IDEA_BASE_DIR>/idea-C-merge-runs.pl</value>
      </param>
    </command>
    <command>
      <name>parse-output</name>
      <configMapId>1.4</configMapId>
      <type>RunUnixCommand</type>
      <param>
	<key>command</key>
	<value><IDEA_BASE_DIR>/idea-D-parse-output.pl</value>
      </param>
    </command>
  </commandSet> <!-- End top level command set -->
</commandSetRoot> <!-- End of root -->
