<?xml version="1.0" encoding="UTF-8"?>
    
<commandSetRoot type="template" xmlns:xsi="http://www.w3.org/2001/XMLSchema-instance"
				xsi:schemaLocation='commandSet.xsd'>
    <commandSet type="serial">
        <name>Unix Command Flow</name>
        <configMapId>1</configMapId>
        <commandSet type="parallel">
            <configMapId>1.2</configMapId>
            <name>Sub Workflow</name>
            <command>
              <name>IterCommand</name>
              <configMapId>1.2.1</configMapId>
            </command>
          <restarted>false</restarted>
        </commandSet>
      <restarted>false</restarted>
    </commandSet> <!-- End top level command set -->
</commandSetRoot> <!-- End of root -->
