<?xml version="1.0" encoding="UTF-8"?>
    
<commandSetRoot type="template" xmlns:xsi="http://www.w3.org/2001/XMLSchema-instance"
				xsi:schemaLocation='commandSet.xsd'>
	<commandSet type="serial">
		<name>SerialSingleWorkflow</name>
		<configMapId>1</configMapId>
		<command>
			<name>CheckUpdates</name>
			<configMapId>1.1</configMapId>
		</command> <!-- End of command CheckUpdates-->
		<command>
			<name>VerifySequence</name>
			<configMapId>1.3</configMapId>
		</command> <!-- End of command VerifySequence-->
		<command>
			<name>WriteSequence</name>
			<configMapId>1.2</configMapId>
		</command> <!-- End of WriteSequence -->
	  <restarted>false</restarted>
	</commandSet> <!-- End top level command set -->
</commandSetRoot> <!-- End of root -->
