<?xml version="1.0" encoding="UTF-8"?>
    
<commandSetRoot type="template" xmlns:xsi="http://www.w3.org/2001/XMLSchema-instance"
				xsi:schemaLocation='commandSet.xsd'>
	<commandSet type="serial">
		<name>simple command set with DCE command</name>
		<configMapId>1</configMapId>
		<command>
			<name>RunUnixCommand</name>
			<configMapId>1.1</configMapId>
		</command> 
		<command>
			<name>RunUnixCommand</name>
			<configMapId>1.2</configMapId>
		</command> 
	  <restarted>false</restarted>
	</commandSet> <!-- End top level command set -->
</commandSetRoot> <!-- End of root -->
