<?xml version="1.0" encoding="UTF-8"?>
    
<commandSetRoot xmlns:xsi="http://www.w3.org/2001/XMLSchema-instance"
				xsi:schemaLocation='commandSet.xsd'>
	<commandSet type="parallel">
		<name>ParallelSingleWorkflow</name>
		<configMapId>1</configMapId>
		<command>
			<name>checkUpdates</name>
			<configMapId>1.1</configMapId>
		</command> <!-- End of command check updates -->
		<command>
			<name>writeSequence</name>
			<configMapId>1.2</configMapId>
		</command> <!-- End of command write Sequence -->
		<command>
			<name>verifySequence</name>
			<configMapId>1.3</configMapId>
		</command> <!-- End of command verify Sequences -->
		<command>
			<name>predictFunction</name>
			<configMapId>1.5</configMapId>
		</command> <!-- End of command predict-->
	  <restarted>false</restarted>
	</commandSet> <!-- End top level command set -->
</commandSetRoot> <!-- End of root -->
